{
  "contract_version": "1.0.0",
  "handoff_id": "handoff-figure-readout-missing-qc",
  "skill_context": "cross-skill",
  "claim_readout_map": [
    {
      "claim_id": "C1",
      "claim_text": "Figure 2 supports a protocol-derived cell-state transition claim.",
      "evidence_role": "decisive",
      "readout_id": "R1",
      "readout_supports": "Cell-state transition if the imaging and quantification QC gates pass.",
      "protocol_step_or_method": "Imaging quantification stage",
      "parameter_authority": "unresolved",
      "qc_gate": "Positive control and negative control must define segmentation threshold and fail action.",
      "failure_mode": "Subjective thresholding could create a false-positive transition signal.",
      "manuscript_impact": "The figure cannot be decisive until the protocol QC gate is specified.",
      "revision_action": "add_qc_gate",
      "source_ids": ["M1", "S1"]
    }
  ],
  "extensions": {
    "biological_protocol_reviewer": {
      "source_record_ids": ["M1", "S1"],
      "notes": "BPR evidence-ledger records used for this handoff."
    }
  }
}
